{
  "type": "object",
  "properties": {
    "attempt_id": {
      "type": "string",
      "pattern": "^[0-9a-f]{8}-[0-9a-f]{4}-[0-9a-f]{4}-[0-9a-f]{4}-[0-9a-f]{12}$"
    },
    "session_id": {
      "type": "string",
      "pattern": "^[0-9a-f]{8}-[0-9a-f]{4}-[0-9a-f]{4}-[0-9a-f]{4}-[0-9a-f]{12}$"
    },
    "task_id": {
      "type": "string",
      "pattern": "^[0-9a-f]{8}-[0-9a-f]{4}-[0-9a-f]{4}-[0-9a-f]{4}-[0-9a-f]{12}$"
    },
    "case_key": {
      "type": "string",
      "minLength": 1
    },
    "ordinal": {
      "type": "integer",
      "minimum": 0
    },
    "started_at": {
      "type": "string",
      "pattern": "^\\d{4}-\\d{2}-\\d{2}T\\d{2}:\\d{2}:\\d{2}(\\.\\d+)?Z$"
    },
    "ended_at": {
      "anyOf": [
        {
          "type": "string",
          "pattern": "^\\d{4}-\\d{2}-\\d{2}T\\d{2}:\\d{2}:\\d{2}(\\.\\d+)?Z$"
        },
        {
          "type": "null"
        }
      ]
    },
    "state": {
      "type": "string",
      "enum": [
        "RUNNING",
        "SUCCEEDED",
        "REJECTED",
        "FAILED",
        "INTERRUPTED"
      ]
    },
    "exit_code": {
      "anyOf": [
        {
          "type": "integer"
        },
        {
          "type": "null"
        }
      ]
    },
    "process_group": {
      "anyOf": [
        {
          "type": "integer",
          "minimum": 0
        },
        {
          "type": "null"
        }
      ]
    },
    "release_status": {
      "type": "string",
      "enum": [
        "NOT_CHECKED",
        "RELEASED",
        "RESIDUAL",
        "UNKNOWN"
      ]
    },
    "released_at": {
      "anyOf": [
        {
          "type": "string",
          "pattern": "^\\d{4}-\\d{2}-\\d{2}T\\d{2}:\\d{2}:\\d{2}(\\.\\d+)?Z$"
        },
        {
          "type": "null"
        }
      ]
    },
    "evidence_ids": {
      "type": "array",
      "items": {
        "type": "string",
        "minLength": 1
      },
      "minItems": 0
    },
    "reason": {
      "anyOf": [
        {
          "type": "string",
          "minLength": 1
        },
        {
          "type": "null"
        }
      ]
    },
    "schema_version": {
      "const": 1
    },
    "extensions": {
      "type": "object"
    },
    "protocol_version": {
      "const": "latency-v1"
    }
  },
  "required": [
    "attempt_id",
    "session_id",
    "task_id",
    "case_key",
    "ordinal",
    "started_at",
    "ended_at",
    "state",
    "exit_code",
    "process_group",
    "release_status",
    "released_at",
    "evidence_ids",
    "reason",
    "schema_version",
    "extensions",
    "protocol_version"
  ],
  "additionalProperties": false,
  "$schema": "https://json-schema.org/draft/2020-12/schema",
  "$id": "https://kernelx.invalid/schema/v1/attempt",
  "$defs": {}
}
